{
  "generated_at": "2026-04-13T01:21:12Z",
  "source_window": "manual venum sweep",
  "market_posture": {
    "label": "defensive",
    "confidence": 0.88,
    "summary": "macro and liquidity stress are weighing on trader behavior more than pure greed"
  },
  "dominant_narratives": [
    {
      "label": "macro stress is shaping risk appetite",
      "strength": 0.58,
      "direction": "steady",
      "confidence": 0.84,
      "summary": "headline and macro terms are crowding the room and changing posture"
    },
    {
      "label": "liquidity is getting more attention than pure story",
      "strength": 0.58,
      "direction": "steady",
      "confidence": 0.84,
      "summary": "the room is talking about flow and funding more than clean belief"
    },
    {
      "label": "rotation is competing with conviction",
      "strength": 0.5,
      "direction": "steady",
      "confidence": 0.8,
      "summary": "the room sounds more rotational than loyal"
    }
  ],
  "emerging_narratives": [],
  "fading_narratives": [
    {
      "label": "broad everything-rips optimism",
      "strength": 0.35,
      "direction": "fading",
      "confidence": 0.72,
      "summary": "the room does not feel wide-open even if chatter volume remains high"
    }
  ],
  "attention_quality": {
    "label": "cross_room",
    "confidence": 0.73,
    "summary": "multiple accounts and repeated themes suggest the attention is not isolated to one pocket"
  },
  "trader_psychology": [
    "defensive",
    "hesitant"
  ],
  "lane_implications": {
    "runner_hunter": {
      "posture": "avoid_forcing",
      "confidence": 0.74,
      "summary": "runner quality is likely thinner and clean no-trade behavior should be trusted"
    },
    "scalper": {
      "posture": "faster_exits",
      "confidence": 0.72,
      "summary": "shorter tactical moves may still work but conviction can vanish quickly"
    },
    "sniper": {
      "posture": "higher_fakeout_risk",
      "confidence": 0.7,
      "summary": "headline sensitivity and fast crowd shifts increase the chance of getting used as exit liquidity"
    }
  },
  "supporting_signals": [
    {
      "source": "topic_tags",
      "signal": "repeated tags: liquidity, bitcoin, headline",
      "strength": 0.44
    },
    {
      "source": "macro_terms",
      "signal": "macro or liquidity language is present in the room",
      "strength": 0.76
    },
    {
      "source": "expansion_terms",
      "signal": "runner or expansion language is still present",
      "strength": 0.68
    }
  ],
  "warnings": [
    "do not treat narrative posture as a direct buy or sell trigger",
    "use this brief for posture and regime context only",
    "trust selective or no-trade behavior when structure does not confirm the room story"
  ]
}